-- !!! If you want to run regression tests, you need to create a database named "test" in MonetDB with the default port 50000.
CREATE EXTENSION monetdb_fdw;
CREATE SERVER foreign_server FOREIGN DATA WRAPPER monetdb_fdw
OPTIONS (host '127.0.0.1', port '50000', dbname 'test');
CREATE USER MAPPING FOR CURRENT_USER SERVER foreign_server OPTIONS (user 'monetdb', password 'monetdb');
SELECT monetdb_execute('foreign_server', $$DROP USER test_u$$);
ERROR:  [MonetDB ERROR] DROP USER: no such user role 'test_u'

SELECT monetdb_execute('foreign_server', $$CREATE USER "test_u" WITH PASSWORD 'test_u' NAME 'test_user' SCHEMA "sys"$$);
 monetdb_execute 
-----------------
 
(1 row)

SELECT monetdb_execute('foreign_server', $$CREATE SCHEMA IF NOT EXISTS "test_u" AUTHORIZATION "test_u"$$);
 monetdb_execute 
-----------------
 
(1 row)

SELECT monetdb_execute('foreign_server', $$ALTER USER "test_u" SET SCHEMA "test_u"$$);
 monetdb_execute 
-----------------
 
(1 row)

DROP USER MAPPING FOR CURRENT_USER SERVER foreign_server;
CREATE USER MAPPING FOR CURRENT_USER SERVER foreign_server OPTIONS (user 'test_u', password 'test_u');
SELECT monetdb_execute('foreign_server', $$CREATE TABLE emp( name VARCHAR(20), age INTEGER)$$);
 monetdb_execute 
-----------------
 
(1 row)

CREATE FOREIGN TABLE emp(
        name VARCHAR(20),
        age INTEGER
)
SERVER foreign_server
OPTIONS (schema_name 'test_u', table_name 'emp');
\des
             List of foreign servers
      Name      |  Owner   | Foreign-data wrapper 
----------------+----------+----------------------
 foreign_server | postgres | monetdb_fdw
(1 row)

\d+ emp
                                              Foreign table "public.emp"
 Column |         Type          | Collation | Nullable | Default | FDW options | Storage  | Stats target | Description 
--------+-----------------------+-----------+----------+---------+-------------+----------+--------------+-------------
 name   | character varying(20) |           |          |         |             | extended |              | 
 age    | integer               |           |          |         |             | plain    |              | 
Server: foreign_server
FDW options: (schema_name 'test_u', table_name 'emp')

-- test insert 
INSERT INTO emp VALUES('John', 23);
INSERT INTO emp VALUES('Mary', 22);
-- test select
SELECT * FROM emp;
 name | age 
------+-----
 John |  23
 Mary |  22
(2 rows)

SELECT monetdb_execute('foreign_server', $$SELECT * FROM emp$$);
INFO:  
name,age
[ "John",	23	]
[ "Mary",	22	]

 monetdb_execute 
-----------------
 
(1 row)

-- test explain
-- EXPLAIN (COSTS OFF) SELECT * FROM emp;
EXPLAIN (COSTS OFF) INSERT INTO emp VALUES('Mary test', 21);
                              QUERY PLAN                              
----------------------------------------------------------------------
 Insert on emp
   MonetDB statement: INSERT INTO test_u.emp(name, age) VALUES (?, ?)
   ->  Result
(3 rows)

-- test truncate
TRUNCATE emp;
SELECT * FROM emp;
 name | age 
------+-----
(0 rows)

INSERT INTO emp VALUES('John', 23);
INSERT INTO emp VALUES('Mary', 22);
TRUNCATE TABLE emp;
SELECT * FROM emp;
 name | age 
------+-----
(0 rows)

SELECT monetdb_execute('foreign_server', $$CREATE TABLE delete_emp(name VARCHAR(20) PRIMARY KEY, age INTEGER)$$);
 monetdb_execute 
-----------------
 
(1 row)

CREATE FOREIGN TABLE delete_emp(
        name VARCHAR(20),
        age INTEGER
)
SERVER foreign_server
OPTIONS (schema_name 'test_u', table_name 'delete_emp');
INSERT INTO delete_emp VALUES('John', 23);
INSERT INTO delete_emp VALUES('Mary', 22);
SELECT * FROM delete_emp;
 name | age 
------+-----
 John |  23
 Mary |  22
(2 rows)

INSERT INTO delete_emp VALUES('Mary', 22); -- error
ERROR:  [MonetDB ERROR] INSERT INTO: PRIMARY KEY constraint 'delete_emp.delete_emp_name_pkey' violated

INSERT INTO delete_emp VALUES('Mary2', 22);
SELECT * FROM delete_emp;
 name  | age 
-------+-----
 John  |  23
 Mary  |  22
 Mary2 |  22
(3 rows)

-- test delete
DELETE FROM delete_emp WHERE name = 'John'; -- error, need set key
ERROR:  no primary key column specified for foreign MonetDB table
DETAIL:  For UPDATE or DELETE, at least one foreign table column must be marked as primary key column.
ALTER FOREIGN TABLE delete_emp ALTER name OPTIONS (ADD key 'true');
DELETE FROM delete_emp WHERE name = 'John';
SELECT * FROM delete_emp;
 name  | age 
-------+-----
 Mary  |  22
 Mary2 |  22
(2 rows)

DELETE FROM delete_emp WHERE age = 22;
SELECT * FROM delete_emp;
 name | age 
------+-----
(0 rows)

set client_min_messages = 'debug2';
INSERT INTO emp VALUES('John', 23);
DEBUG:  monetdb: host: 127.0.0.1 port: 50000 user: test_u password: test_u dbname: test
DEBUG:  monetdb_fdw remote prepare query is: INSERT INTO test_u.emp(name, age) VALUES (?, ?)
DEBUG:  monetdb_fdw bind value0: John
DEBUG:  monetdb_fdw bind value1: 23
INSERT INTO emp VALUES('Mary', 22);
DEBUG:  monetdb: host: 127.0.0.1 port: 50000 user: test_u password: test_u dbname: test
DEBUG:  monetdb_fdw remote prepare query is: INSERT INTO test_u.emp(name, age) VALUES (?, ?)
DEBUG:  monetdb_fdw bind value0: Mary
DEBUG:  monetdb_fdw bind value1: 22
SELECT * FROM emp;
DEBUG:  monetdb: host: 127.0.0.1 port: 50000 user: test_u password: test_u dbname: test
DEBUG:  monetdb_fdw remote query is: SELECT name, age FROM test_u.emp
 name | age 
------+-----
 John |  23
 Mary |  22
(2 rows)

INSERT INTO delete_emp VALUES('John', 23);
DEBUG:  monetdb: host: 127.0.0.1 port: 50000 user: test_u password: test_u dbname: test
DEBUG:  monetdb_fdw remote prepare query is: INSERT INTO test_u.delete_emp(name, age) VALUES (?, ?)
DEBUG:  monetdb_fdw bind value0: John
DEBUG:  monetdb_fdw bind value1: 23
INSERT INTO delete_emp VALUES('Mary', 22);
DEBUG:  monetdb: host: 127.0.0.1 port: 50000 user: test_u password: test_u dbname: test
DEBUG:  monetdb_fdw remote prepare query is: INSERT INTO test_u.delete_emp(name, age) VALUES (?, ?)
DEBUG:  monetdb_fdw bind value0: Mary
DEBUG:  monetdb_fdw bind value1: 22
SELECT * FROM delete_emp;
DEBUG:  monetdb: host: 127.0.0.1 port: 50000 user: test_u password: test_u dbname: test
DEBUG:  monetdb_fdw remote query is: SELECT name, age FROM test_u.delete_emp
 name | age 
------+-----
 John |  23
 Mary |  22
(2 rows)

-- test update
UPDATE emp SET name = 'Mary2' WHERE name = 'Mary'; -- error
ERROR:  no primary key column specified for foreign MonetDB table
DETAIL:  For UPDATE or DELETE, at least one foreign table column must be marked as primary key column.
UPDATE delete_emp SET name = 'Mary2' WHERE name = 'Mary'; -- ok
DEBUG:  monetdb: host: 127.0.0.1 port: 50000 user: test_u password: test_u dbname: test
DEBUG:  monetdb: host: 127.0.0.1 port: 50000 user: test_u password: test_u dbname: test
DEBUG:  monetdb_fdw remote query is: SELECT name, age FROM test_u.delete_emp WHERE ((name = 'Mary')) /* FOR UPDATE */
DEBUG:  monetdb_fdw remote prepare query is: UPDATE test_u.delete_emp SET name = ? WHERE name = ?
DEBUG:  monetdb_fdw bind value0: Mary2
DEBUG:  monetdb_fdw bind value1: Mary
SELECT * FROM delete_emp;
DEBUG:  monetdb: host: 127.0.0.1 port: 50000 user: test_u password: test_u dbname: test
DEBUG:  monetdb_fdw remote query is: SELECT name, age FROM test_u.delete_emp
 name  | age 
-------+-----
 John  |  23
 Mary2 |  22
(2 rows)

UPDATE delete_emp SET name = 'John2' WHERE age = 23; 
DEBUG:  monetdb: host: 127.0.0.1 port: 50000 user: test_u password: test_u dbname: test
DEBUG:  monetdb: host: 127.0.0.1 port: 50000 user: test_u password: test_u dbname: test
DEBUG:  monetdb_fdw remote query is: SELECT name, age FROM test_u.delete_emp WHERE ((age = 23)) /* FOR UPDATE */
DEBUG:  monetdb_fdw remote prepare query is: UPDATE test_u.delete_emp SET name = ? WHERE name = ?
DEBUG:  monetdb_fdw bind value0: John2
DEBUG:  monetdb_fdw bind value1: John
SELECT * FROM delete_emp;
DEBUG:  monetdb: host: 127.0.0.1 port: 50000 user: test_u password: test_u dbname: test
DEBUG:  monetdb_fdw remote query is: SELECT name, age FROM test_u.delete_emp
 name  | age 
-------+-----
 John2 |  23
 Mary2 |  22
(2 rows)

-- test returning
INSERT INTO delete_emp VALUES('John', 23) RETURNING *;
DEBUG:  monetdb: host: 127.0.0.1 port: 50000 user: test_u password: test_u dbname: test
DEBUG:  monetdb_fdw remote prepare query is: INSERT INTO test_u.delete_emp(name, age) VALUES (?, ?) RETURNING name, age
DEBUG:  monetdb_fdw bind value0: John
DEBUG:  monetdb_fdw bind value1: 23
 name | age 
------+-----
 John |  23
(1 row)

DELETE FROM delete_emp WHERE name = 'John' RETURNING *;
DEBUG:  monetdb: host: 127.0.0.1 port: 50000 user: test_u password: test_u dbname: test
DEBUG:  monetdb: host: 127.0.0.1 port: 50000 user: test_u password: test_u dbname: test
DEBUG:  monetdb_fdw remote query is: SELECT name FROM test_u.delete_emp WHERE ((name = 'John')) /* FOR UPDATE */
DEBUG:  monetdb_fdw remote prepare query is: DELETE FROM test_u.delete_emp WHERE name = ? RETURNING name, age
DEBUG:  monetdb_fdw bind value0: John
 name | age 
------+-----
 John |  23
(1 row)

SELECT * FROM delete_emp;
DEBUG:  monetdb: host: 127.0.0.1 port: 50000 user: test_u password: test_u dbname: test
DEBUG:  monetdb_fdw remote query is: SELECT name, age FROM test_u.delete_emp
 name  | age 
-------+-----
 John2 |  23
 Mary2 |  22
(2 rows)

UPDATE delete_emp SET name = 'Mary' WHERE name = 'Mary2' RETURNING *; -- error, MonetDB "UPDATE ... RETURNING" has bug
DEBUG:  monetdb: host: 127.0.0.1 port: 50000 user: test_u password: test_u dbname: test
DEBUG:  monetdb: host: 127.0.0.1 port: 50000 user: test_u password: test_u dbname: test
DEBUG:  monetdb_fdw remote query is: SELECT name, age FROM test_u.delete_emp WHERE ((name = 'Mary2')) /* FOR UPDATE */
DEBUG:  monetdb_fdw remote prepare query is: UPDATE test_u.delete_emp SET name = ? WHERE name = ? RETURNING name, age
DEBUG:  monetdb_fdw bind value0: Mary
DEBUG:  monetdb_fdw bind value1: Mary2
ERROR:  [MonetDB ERROR] (null)
SELECT * FROM delete_emp;
DEBUG:  monetdb: host: 127.0.0.1 port: 50000 user: test_u password: test_u dbname: test
DEBUG:  monetdb_fdw remote query is: SELECT name, age FROM test_u.delete_emp
 name  | age 
-------+-----
 John2 |  23
 Mary2 |  22
(2 rows)

set client_min_messages = 'INFO';
SELECT monetdb_execute('foreign_server', $$DROP TABLE delete_emp$$);
 monetdb_execute 
-----------------
 
(1 row)

SELECT monetdb_execute('foreign_server', $$DROP TABLE emp$$);
 monetdb_execute 
-----------------
 
(1 row)

SELECT monetdb_execute('foreign_server', $$ALTER USER test_u SET SCHEMA sys$$);
 monetdb_execute 
-----------------
 
(1 row)

SELECT monetdb_execute('foreign_server', $$DROP SCHEMA test_u$$);
 monetdb_execute 
-----------------
 
(1 row)

SELECT monetdb_execute('foreign_server', $$DROP USER test_u$$);
 monetdb_execute 
-----------------
 
(1 row)

